Catégories,Sous-catégories,Produits ,Alternatives,Descriptions ,Où trouver,Liens,Lien de l'image,Filtre
Maison,Conservation,Sac de conservation ,Sac en gaze coton bio ,Les sacs en gaze de coton bio sont très utiles pour la conservation et le transport des aliments. Leurs super-pouvoirs ? Ils sont réutilisables et résistants.,"Pour découvrir ces sacs en gaze de chez Nature et Découvertes, c'est juste ici !",https://www.natureetdecouvertes.com/outdoor/camping-bivouac/restauration-hydratation/5-sacs-reutilisables-fruits-et-legumes-91483910,https://www.natureetdecouvertes.com/fstrz/r/s/cache.natureetdecouvertes.com/Medias/Images/Articles/91483910/500?frz-v=312,En ligne
Maison,Conservation,Sac de conservation ,Sac en gaze coton bio ,"Pour transporter et conserver tes aliments, les sacs en gaze de coton bio sont une alternative super simple ! Ils ont une attaque secrète, ils remplacent même les sacs plastiques. ",Les sacs en gaze de coton bio de chez Greenweez sont par ici !,https://www.greenweez.com/ah-table-lot-de-5-sacs-fruits-et-legumes-30-x-33cm-p76981,https://www.dubruitdanslacuisine.fr/media/catalog/product/cache/image/800x800/e9c3970ab036de70892d86c6d221abfe/s/a/sac-a-vrac-en-coton-bio-25x30cm-pebbly_3.jpg,En ligne
Maison,Conservation,Sac de congélation,Sac de congélation écologique,Les sacs de congélation écologiques sont conçus sans ressource fossile ou pétrolière. C'est meilleur pour la planète et pour tes aliments ! ,"Sur Greenweez, tu peux trouver en un clic ce type de sac de congélation !",https://www.greenweez.com/ah-table-30-sacs-de-congelation-18-x-25cm-p45518,https://fac.img.pmdstatic.net/fit/http.3A.2F.2Fprd2-bone-image.2Es3-website-eu-west-1.2Eamazonaws.2Ecom.2Ffac.2F2020.2F02.2F07.2Fff24c2f6-d62f-4ff8-bf0e-694b77beda80.2Ejpeg/850x478/quality/80/crop-from/center/focus-point/599%2C521/8-astuces-etonnantes-avec-un-sac-de-congelation.jpeg,En ligne
Maison,Conservation,Film alimentaire,Couvre plat lin bio,"Les couvre-plats en tissus, lin bio permettent d'emballer tes gâteaux, préparer tes pique-niques et de protéger tes plats. Ils sont réutilisables et lavables. ",Ces couvre-plats en lin bio sont disponibles sur la Boutique Zéro Dechet.,https://www.boutiquezerodechet.com/maison-zero-dechet/43-couvre-plat.html,https://www.angiebegreen.com/wp-content/uploads/2020/09/MG_5737.jpg,En ligne
Maison,Conservation,Film alimentaire,Couvre plat lin bio,"Protéger ses plats autant que la planète, c'est possible avec ces couvre-plats en lin ! En plus d'emballer tes créations culinaires, ils sont lavables et réutilisables.","Si tu es emballé(e) par ces couvre-plats, ils sont disponibles sur Obocal.",http://obocal.com/produits/accessoires-reutilisables/couvre-plat-en-tissus-22-cm-1/,https://www.angiebegreen.com/wp-content/uploads/2020/09/MG_5737.jpg,En ligne
Maison,Conservation,Film alimentaire,Wrap cire d'abeille,"Les wraps de cire d'abeille permettent de remplacer le film alimentaire et autres films d'emballages jetables. Leurs super-pouvoirs ? Être  réutilisables et malléables ! Ils peuvent se mettre directement sur l'aliment, parce qu'ils sont biodégrables et sans plastique.",Ces wraps en cire d'abeille sont disponibles sur la Boutique Zéro Déchet !,https://www.boutiquezerodechet.com/maison-zero-dechet/213-emballage-en-cire-d-abeille.html,https://zoessentiels.com/wp-content/uploads/emballage-petit-moyen-grand.jpg,En ligne
Maison,Conservation,Film alimentaire,Wrap cire d'abeille,"Tu cherches à remplacer ton film alimentaire ? La solution qui protège autant ta planète que tes aliments se trouve dans les wraps en cire d'abeille. Ils sont réutilisables, malléables, biodégradables et sans plastique !",Les wraps en cire d'abeille de chez Nature et Découverte sont par là !,https://embalvert.com/collections/embal-packs,https://i.ebayimg.com/images/g/dpAAAOSwSK9eKr4O/s-l1600.jpg,En ligne
Maison,Conservation,Film alimentaire,Wrap cire d'abeille,Tu te sens d'humeur créative mais tu n'as pas beaucoup temps ? Nous te proposons un DIY qui te permettra de fabriquer toi même tes Wrap en Cire d'Abeille avec ton tissu préféré ! Cette alternative te permettra de remplacer ton film alimentaire tout en protègeant tes aliments. Ces Wraps sont réutilisables et biodégradables !,"Sur le superbe blog de Laissons Lucie Faire, tu retrouve un tutoriel pour réaliser ces Wrap en Cire d'Abeille !",https://laissonsluciefaire.com/2017/12/23/beeswax-wrap/,https://laissonsluciefairedotcom.files.wordpress.com/2017/12/dsc05212.jpg,DIY
Maison,Conservation,Boîte de conservation plastique,Boîte de conservation en Bambou,Les boîtes de conservation en Bambou sont éco-responsables et plus résistantes que le plastique. Tu peux les mettre au lave-vaiselle sans risque et elles font leur effet avec leur design sobre et élégant. ,Les boîtes de conservation en Bambou sont disponibles sur Greenweez !,https://www.greenweez.com/packs-zero-dechet-pack-decouverte-zero-dechet-boites-bambou-blanc-casse-p107954,https://www.arquitecturaydiseno.es/medio/2020/02/24/fiambrera-de-bambu_ab05a9ec_439x599.jpg,En ligne
Maison,Conservation,Boîte de conservation plastique,Boîte de conservation en Bambou,"Elles sont éco-responsable, plus résistantes que le plastique et elles passent même au lave-vaisselle. Qui sont-elles ? Ce sont les boîtes de conservation en Bambou !","Sur Habitat, tu peux trouver en un clic ce type de boîtes de conservation en Bambou.",https://www.habitat.fr/p/pongo-lot-de-3-boites-de-conservation-en-melamine-de-bambou,https://www.arquitecturaydiseno.es/medio/2020/02/24/%5B10%5D-trio-de-ases_92247624_1011x1240.jpg,En ligne
Maison,Conservation,Boîte de conservation plastique,Boîte de conservation en Bambou,"Avec leur style minimaliste, les boîtes de conservation en Bambou ont beaucoup de qualités ! Elles résistent au lavage du lave-vaisselle et sont même bien plus résistante que le plastique ! Et, pour être dans notre sélection, elles sont évidemment éco-responsable !",Ces boîtes de conservation en Bambou sont disponibles sur la Little Marmaille !,https://www.littlemarmaille.fr/produit/lot-de-2-boites-de-conservation-bleu/,"https://static.westwingnow.de/image/upload/e_trim/f_webp/c_pad,w_208,h_277,pd_38_17_38_17/simple/21/4341/1230428.jpg",En ligne
Maison,Conservation,Boîte de conservation plastique,Boîte de conservation en Inox ,"Les boîtes de conservation en Inox sont éco-responsables et incassables. Tu peux les mettre au réutilisables sans risque de rouille, et au four (attention pas au micro-onde). ","Les boîtes de conservation en Inox sont disponibles chez Sans BPA, juste par ici !",https://www.sans-bpa.com/boites-emballages/1838-onyx-mini.html,https://p7014794.vo.llnwd.net/e1/media/catalog/product/cache/8a7c6b25d9e0c0695377faf36eecef90/u/-/u-konserve-big-mini-2.jpg,En ligne
Maison,Conservation,Boîte de conservation plastique,Boîte de conservation en Inox ,"Durables et incassables, les boites de conservation en Inox peuvent être lavées au lave-vaisselle et tu peux les mettre au four. Elles résistent à tout sauf au four à micro-onde !","Pour en savoir plus, c'est par ici sur Greenweez !",https://www.greenweez.com/boites-en-inox-c5173,https://blog.but.fr/wp-content/uploads/2019/07/04-contenance-boite-hermetique.jpg,En ligne
Maison,Conservation,Boîte de conservation plastique,Boîte de conservation en Inox ,"Tu cherches à remplacer tes boites de conservation en plastique ? Les boites de conservation en Inox ont de nombreuses qualités : éco-responsables, incassables, lavables au lave-vaisselle et elles passent même au four traditionnel ! Malgré leur allergie au micro-onde, elles  ont un look d'en-fer !","Sur la Boutique Zéro Déchet, tu peux retrouver de super boites de conservation en Inox !",https://www.boutiquezerodechet.com/49-recipients-zero-dechet,https://www.outmore.dk/img/shopid/7/varer/1200/madkasse-solo-rectangle-0705105013091-rt1.jpg,En ligne
Maison,Conservation,Boîte de conservation plastique,Boîte de conservation en Verre,"Les boîtes de conservation en verre sont éco-responsables et multi-usages. Tu peux conserver, transporter tes aliments (comme pour les boîtes en inox, et en bambou) mais également réchauffer tes petits plats. Leur secret ? Elles passent au lave-vaiselle, au four et même au micro-onde. ",Des boîtes de conservation en verre sont disponibles sur Greenweez !,https://www.greenweez.com/boites-en-verre-c2179,https://img-s1.onedio.com/id-5e445fd97cf13e81245807a2/rev-0/w-635/f-jpg-webp/s-4278908c95f3114d5c8452965392bed9a45d08e6.webp,En ligne
Maison,Conservation,Boîte de conservation plastique,Boîte de conservation en Verre,"Avec l'élégance du verre, ces boîtes de conservations te permettent de conserver, transporter et réchauffer tes délicieuses créations culinaires ! En fait, elles sont éco-responsables et multi-usages ! Leur seul défaut ? Elles ne peuvent pas servir de boule de cristal !","Si tu veux devenir vert avec ces boites en verre, c'est pas ici, sur la Boutique Zéro Déchet !",https://www.boutiquezerodechet.com/maison-zero-dechet/184-boite-hermetique-en-verre.html,https://blog.but.fr/wp-content/uploads/2019/07/04-contenance-boite-hermetique.jpg,En ligne
Maison,Conservation,Boîte de conservation plastique,Boîte de conservation en Verre,"Qui peut résister durablement  au lave-vaisselle, au four et au micro-onde ? Ce sont les boites de conservation en verre ! Avec, tu pourras conserver, transporter et réchauffer tes petits plats. En fait, il nous suffit juste de te dire qu'elles sont éco-responsables et (vraiment) multi-usages, et tu sais tout !",N'hésite pas et va jeter un oeil sur Sans BPA !,https://www.sans-bpa.com/961-boites-verre,https://images-na.ssl-images-amazon.com/images/I/91ggQAgoHcL._AC_SL1500_.jpg,En ligne
Maison,Cuisson,Casserole,Casserole en Inox ,"Les casseroles en Inox te permettent de cuire tes aliments de manière plus saine et de réduire ton impact écologique. En effet, elles sont dépourvues de revêtements anti-adhésif qui sont toxiques pour la santé et pour l'environnement. Les casseroles en Inox sont très résistantes et faciles à nettoyer.  ",Les casseroles en Inox sont disponibles sur Un Coq Dans La Transat.,https://uncoqdansletransat.fr/65-casseroles-poeles-faitouts,https://amelioretasante.com/wp-content/uploads/2018/07/casseroles-nettoyer.jpg,En ligne
Maison,Cuisson,Casserole,Casserole en Inox ,"Une casserole en inox est naturellement anti-adhésive grâce à sa matière. Ainsi tu peux éviter d'acheter des casseroles contenant des produits anti-adhésifs nocifs pour la santé. De plus, l'inox est un matériau solide et durable. Cette option semble être la meilleure pour l'environnement.",Tu peux trouver toutes les références de casseroles sur le site Cristel !,https://www.cristel.com/,https://www.cristel.com/ressources/produits/photos/zoom_cxxqmp2.jpg,En ligne
Maison,Cuisson,Poêle,Poêle en fonte ,Les poêles en fonte sont incassables. L'absence de revêtement anti-adhésif permet une durabilité et une cuisine plus saine. ,Les poêles en fonte sont disponibles sur Staub Online.,https://www.staub-online.com/content/staub/fr/fr/categories/fonte.html,https://www.collinishop.it/media/catalog/product/cache/all/image/1800x/040ec09b1e35df139433887a97daa66f/s/t/staub-pan_2.jpg,En ligne
Maison,Cuisson,Poêle,Poêle en fonte ,"Super durable et incassables, qui sont-elles ? Ce sont les poêles en fonte qui te garantissent une cuisine et une planèten plus saines !",N'hésites plus et va jeter un oeil sur Le Creuset !,https://www.lecreuset.fr/recherche-par-materiel/fonte-emaillee/shopby/,https://cdn.cutleryandmore.com/media/images/17777.jpg,En ligne
Maison,Cuisson,Poêle,Poêle en inox ,"Les poêles en Inox permettent de cuire tes aliments sainement tout en réduisant ton impact écologique. Leurs secrets ? Elles sont dépourvues de revêtements anti-adhésif qui sont toxiques toi et la planète. De plus, elles sont très résistantes et faciles à nettoyer.  ",Des poêles en inox sont disponibles chez Cristel (le site web et pas ton amie du même nom) !,https://www.cristel.com/,https://cdn4.lacasserolerie.com/I-Grande-24448-castel-pro-mini-poele-creuse-sautoir-inox-cristel-d12.net.jpg,En ligne
Maison,Cuisson,Poêle,Poêle en inox ,"Comment cuisiner sainement et protéger la planète en même temps ? Tout simplement, avec les poêles en Inox. Dépourvues de revêtements toxiques, les poêles en Inox sont très résistantes et faciles à entretenir !","Pour découvrir ces poêles en inox chez un Coq dans le Transat, c'est juste ici !",https://uncoqdansletransat.fr/65-casseroles-poeles-faitouts,https://www.vita.gr/wp-content/uploads/2019/09/shutterstock_164132069.jpg,En ligne
Maison,Cuisson,Cocotte minute,Cocote minute garantie à vie en fonte,Les cocottes en fonte sont incassables. L'absence de revêtement permet une durabilité et une cuisine plus saine. Certaines restent même dans les familles pendant plusieurs générations ! ,"Sur Le Creuset, tu peux trouver en un clic ce type de Cocottes Minute !",https://www.lecreuset.fr/recherche-par-materiel/fonte-emaillee/shopby/,https://www.lecreuset.co.za/blog/wp-content/uploads/2019/12/hex.jpg,En ligne
Maison,Cuisson,Cocotte minute,Cocote minute garantie à vie en fonte,"Les cocottes en fonte ont de nombreux super-pouvoirs ! En effet, elles sont incassables, durables et permettent une cuisine plus saine. Votre cocotte en fonte deviendra bientôt un membre à part entière de la famille !",Tu n'as plus une minute à perdre pour en savoir plus ! Cours par ici sur Staub Online !,https://www.staub-online.com/content/staub/fr/fr/categories/fonte.html,https://kissmychef.com/wp-content/uploads/2020/07/STAUB-Cocotte-de-la-mer-4.jpg,En ligne
Maison,Cuisson,Papier cuisson,Papier cuisson 100% compostable,"Le papier cuisson 100% compostable n'a subi aucun traitement chimique. C'est cool pour ta santé et pour la planète. Le + c'est qu'il ne change rien à l'utilisation classique du papier cuisson, il est tout aussi résistant à la chaleur mais il peut aussi servir pour emballer les aliments : fromage, charcuterie, légume.... ! ",Greenweez te propose une recharche de papier cuisson écologique.,https://www.greenweez.com/ah-table-recharge-papier-cuisson-ecologique-39cm-x-15m-p26533?term=,https://img.cuisineaz.com/680x357/2019-06-12/i147575-papier-sulfurise.jpeg,En ligne
Maison,Cuisson,Papier cuisson,Papier cuisson 100% compostable,"Ce papier cuisson, peut aussi bien aller au four, que servir à emballer tes aliments,  tout en étant biodégradable. Il est non-blanchis et n'a reçu aucun traitement. C'est un bien pour toi et ta planète.","Retrouve ce rouleau de papier sur ""toutallantvert"".",https://www.toutallantvert.com/papier-sulfurise-four-et-cuisson-ecologique-compostable-et-recyclable-p-70.html,https://cdn.teb21.com/thumb/1280/028/what-is-parchment-paper.webp,En ligne
Maison,Cuisson,Moules à cuisson,Silicone,Prévilégier des moules à cuisson en silicone permet de garantir une durabilité et donc de réduire son impact écologique. ,Les moules en silicone sont disponibles sur Debuyer !,https://www.debuyer.com/fr/products/moules-souples,https://images-na.ssl-images-amazon.com/images/I/71OBRcvW6gL._SX679_.jpg,En ligne
Maison,Ustensile,Spatule/Cuillère, Bambou,Prévilégier des ustensiles de cuisine en bambou permet de garantir une cuisine saine pour toi mais aussi pour la planète. ,Les ustensiles en bambou sont disponibles sur La Maison du Bambou !,https://lamaisondubambou.com/collections/ustensile-et-accessoire-pour-cuisiner ,https://greenpioneer.co.uk/4992-large_default/organic-essentials-utensil-set-set-of-4.jpg,En ligne
Maison,Ustensile,Pailles,Pailles en Bambou,"Progressivement interdites dans de nombreux pays, les pailles en plastiques asphyxient nos océans. Alors, pour boire ton cocktail préférée (sans alcool) sur la plage, tu peux opter pour ses incroyables pailles réutilisables en bambou !","Maison du Monde te propose ses pailles en bambou, juste ici !",https://www.maisonsdumonde.com/FR/fr/p/pailles-en-bambou-x6-205423.htm,https://image.made-in-china.com/2f0j00tIsGehMzAnkZ/Natural-Bamboo-Straw-Eco-Friendly-Product-for-Drinking.webp,En ligne
Maison,Ustensile,Batteur Electrique,Batteur à Manivelle,"Pour remplacer ton batteur électrique (qui t'a peut être encore laché), nous te proposons le batteur à manivelle. Il est durable, réparable (presque à l'infini) et sans batterie. Et si un orage coupe l'électricité chez toi, tu peux toujours faire ton gâteau préféré !","Nous te proposons le modèle en inox et à manivelle chez Greenweez, juste ici !",https://www.greenweez.com/lacor-batteur-melangeur-a-manivelle-inox-p17364?gclid=Cj0KCQiAqNPyBRCjARIsAKA-WFxmBgb1TV1H7bEiS35k08HLazc3BqTyOAtzhFOEHfFITmv1f8dScR4aArbfEALw_wcB,https://images-na.ssl-images-amazon.com/images/I/71f9HFQccWL._SL1500_.jpg,En ligne
Maison,Scolaire,Cahier,Cahier recyclé,Ce cahier recyclé est issue de papier récupérés post-consommation.,Esprit recyclé a pour objectif de rendre plus abordable les écologiques pour tous les usagers,https://www.esprit-recycle.fr/cahiers-scolaires-ecologiques/242-cahier-a4-recycle-pique-seyes-96p-forever-clairefontaine-3210330171234.html,https://cdn.shopify.com/s/files/1/0082/0746/6576/products/carnet-recycle-pampa-greenandpaper_1024x1024@2x.jpg?v=1570914412,En ligne
Maison,Vétements,Hopaal,Marque de vétements recyclés,"Hopaal est une marque de vétements qui propose des vétements recyclés. En 2020, 82% de leurs matières étatient recyclées.",N'hésite pas à aller voir le site de de Hopaal,https://hopaal.com/,http://chasseursdecool.fr/wp-content/uploads/2017/03/hopaal-t-shirt-recycle-france-bouteilles-coton-bio-home.jpg,En ligne