Catégories,Sous-catégories,Produits ,Alternatives,Descriptions,Où trouver,Liens,Lien de l'image,Filtre,modif chloe
Pitchoune,Accessoire,Jouet ,Cube d'éveil,"Un cube composé de 2 faces en coton, 2 faces de minky dont une brodée au prénom, 1 face en PUL imperméable munie d’une petite poche en double gaze de coton pour y ranger un petit nuage qui fait un bruit de trompette quand on appuie dessus et plein d'autres surprise. De quoi amuser pitchoun quand il s'ennuie ! ",Tu peux retrouver ce merveilleux produit fait avec amour sur ce site ! ,https://www.machouettecouture.fr/home/Cube-déveil-sensoriel-c126047002,https://d2j6dbq0eux0bg.cloudfront.net/images/44275414/2990254514.jpg,En ligne,
Pitchoune,Accessoire,Divers,Quenotte,Une petite quenotte 100 % coton qui permettra de faciliter le travail de la petite souris ! ,"Pour retrouver ce produit fait main, c'est juste ici !",https://www.machouettecouture.fr/home/Quenottes-c116603007,https://d2j6dbq0eux0bg.cloudfront.net/images/44275414/2713979282.jpg,En ligne,
Pitchoune,Accessoire,Serviette de cantine,Bavoire,"Protège les vêtements de pitchoun avec ce bavoir trop mignon, 100 % éco-conçus !","Pour le lien, c'est juste ici ! ",https://www.machouettecouture.fr/home/Serviettes-de-Cantine-c116599508,https://d2j6dbq0eux0bg.cloudfront.net/images/44275414/2537539723.jpg,En ligne,
Pitchoune,Vêtement,Écharpe ,Écharpe / Snood,"Le cou de ton enfant sera protégé du froid cet hiver avec ce joli snood en matière toute douce et réversible.
Tu peux également le personnaliser en faisant broder le prénom de ton enfant.","Pour retrouver ce produit tout confort, c'est juste ici !",https://www.machouettecouture.fr/home/Snoods-c122420615,https://d2j6dbq0eux0bg.cloudfront.net/images/44275414/2701184708.jpg,En ligne,
Pitchoune,Accessoire,Peluche,Doudou rigolo,"Un doudou rigolo pour un pitchoun heureux ! Produit entièrement fait mains, de quoi favoriser l'artisanat ! ","Pour le lien, c'est juste ici ! ",https://www.machouettecouture.fr/home/Doudou-Rigolo-c119987357,https://d2j6dbq0eux0bg.cloudfront.net/images/44275414/2685750819.jpg,En ligne,
Pitchoune,Accessoire,Peluche,Doudou chouette ,"Un doudou chouette qui veillera sur ton pitchoun. En plus d'être mignon, il est fait main ! ",Tu peux retrouver ce merveilleux produit fait avec amour sur ce site !,https://www.machouettecouture.fr/home/Doudou-Chouette-p400447375,https://d2j6dbq0eux0bg.cloudfront.net/images/44275414/2597823768.jpg,En ligne,
Pitchoune,Accessoire,Jouet ,Tapis d'éveil,"En plus d'être jolie, tu pourras garder ce tapis à vie ! Il ne prend pas de place et il est fait avec amour. Finalement, il a tout pour plaire !",Tu peux retrouver ce merveilleux produits fait avec amour sur ce site !,https://www.machouettecouture.fr/home/Tapis-déveil-c125346312,https://d2j6dbq0eux0bg.cloudfront.net/images/44275414/2898424749.jpg,En ligne,
Pitchoune,Accessoire,Divers,Mobile de lit, Cet adorable mobile deviendra un indispensable pour accompagner les rêves de pitchoun. ,"Pour retrouver ce mobile entièrement éco-conçus, c'est juste ici !",https://www.machouettecouture.fr/home/Mobil-de-lit-forêt-p431544450,https://d2j6dbq0eux0bg.cloudfront.net/images/44275414/2848743067.jpg,En ligne,
Pitchoune,Accessoire,Étuis à couches,Panière à couches," En plus d’y mettre les couches, on peut aussi s’en servir pour y ranger les produits de pitchoun ou ses jouets.
Une solution écoresponsable mignonne et efficace ! ","Pour retrouver ce produit fait main, c'est juste ici !",https://www.machouettecouture.fr/home/Panière-à-couches-c122206752,https://d2j6dbq0eux0bg.cloudfront.net/images/44275414/2692935069.jpg,En ligne,
Pitchoune,Accessoire,Protège carnet de santé plastique ,Protège carnet ,Un protège carnet trop mignon fait avec du coton et du minky. Une bonne alternative au protège carnet classique !  ,"Pour le lien, c'est juste ici !",https://www.machouettecouture.fr/home/Protège-Carnet-de-Santé-c122161565,https://d2j6dbq0eux0bg.cloudfront.net/images/44275414/2690795900.jpg,En ligne,
Pitchoune,Accessoire,Anneau de dentition ,Hochet,"Jouet en tissu 100 % coton, il peut servir à la fois de hochet et d’anneau de dentition pour soulager la poussée dentaire. 
Tu peux traiter l’anneau en bois avec de l’huile d’olive ou toute autre huile végétale bio, de quoi rendre sa durée de vie éternelle ! ",Tu peux retrouver ce merveilleux produits fait avec amour sur ce site !,https://www.machouettecouture.fr/home/Anneau-de-dentition-c119987361,https://d2j6dbq0eux0bg.cloudfront.net/images/44275414/2685672225.jpg,En ligne,